1230,EUA enfrentam as temperaturas mais frias dos últimos 20 anos 
1231,As autodefesas avançam no México 
1232,O papel político da esposa de Humala reabre uma polêmica no Peru 
1233,Ofensiva global contra o avanço da Al Qaeda 
1234,A câmara de gás não é uma piada 
1235,O ídolo encapuzado desapareceu 
1236,Uma ministra espanhola viajará ao Panamá pela ‘crise do Canal’ 
1237,Os ex-presos do ETA mostram “total compromisso” com as vias políticas 
1238,Argentina traça um plano anual com quase 500 metas 
1239,Milhares de voos cancelados no nordeste dos EUA pela tormenta 
1240,O chavismo encarcera quatro ex-prefeitos dissidentes 
1241,Guatemala começa 2014 com 24 assassinatos nas primeiras horas 
1242,Nova York diz adeus a seu benfeitor 
1243,Um tirano entre duas mulheres 
1244,Choques entre manifestantes e policiais no Egito deixam 13 mortos 
1245,A primeira tormenta de 2014 nos Estados Unidos 
1246,Milhares de voos cancelados no nordeste dos EUA pela tormenta Hércules 
1247,Pequenos gestos para facilitar a vida 
1248,Venezuela divulga lista negra de turistas que viajaram ao exterior 
1249,A complicada entrada em vigor da reforma da saúde de Obama 
1250,Empreendedoras a 4.000 metros de altura 
1251,Argentina julga os civis envolvidos em crimes da ditadura militar 
1252,Piora o estado de saúde de Ariel Sharon 
1253,A barreira entre os hispânicos e os novos seguros de saúde nos EUA 
1254,Castro exalta a revolução e alerta contra a subversão interna em Cuba 
1255,Colorado inicia a venda legal de maconha para recreação 
1256,A energia elétrica é restabelecida na Argentina após uma onda de calor 
1257,Kerry converte a paz entre israelenses e palestinos na sua cruzada 
1258,Nova York inicia uma nova era progressista com De Blassio 
1259,"Putin promete a ""aniquilação completa dos terroristas"" "
1260,Morre o embaixador palestino em Praga após uma explosão em sua casa 
1261,Kim Jong-un diz que a execução de seu tio liquida a “escória dissidente” 
1262,A América em 2013 por meio de dez vídeos 
1263,Israel libera 26 palestinos acusados de assassinato e terrorismo 
1264,A memória violada 
1265,A pena de morte nos EUA atinge o nível mais baixo em 20 anos 
1266,Identificado suposto autor do atentado na estação de Volgogrado 
1267,Rios da América Latina entre os mais contaminados do mundo 
1268,O Banco Central da Venezuela oficializa uma inflação anual de 56% 
1269,Dacar vai enfrentar os bloqueios de estradas ao passar pela Bolívia 
1270,Um gesto antissemita que sacode a França 
1271,Londres restringe o acesso dos estrangeiros à saúde pública 
1272,Navio com 74 pessoas passará o ano novo encalhado na Antártida 
1273,Quatro jornalistas da Al Jazeera são detidos no Egito 
1274,A vida por uma pepita de ouro 
1275,Cerveja grátis contra a marginalização dos alcoólatras 
1276,El Salvador em estado de alerta pela erupção de um vulcão 
1277,"Um novo atentado
causa ao menos 14 mortes na Rússia "
1278,"Maduro se faz passar por Chávez, por enquanto "
1279,Um atentado em uma estação de trem na Rússia deixa 16 mortos 
1280,O ‘caso Jodorkovski’: um gol da diplomacia secreta alemã 
1281,Os últimos presos políticos da Rússia de Putin 
1282,Buenos Aires decreta emergência energética após cortes de luz 
1283,O pai dos padres gatos de dezembro 
1284,Confusões jurídicas atrasam a ampliação do Canal do Panamá 
1285,O coletivo de presos do ETA reconhece o dano causado 
1286,Sudão do Sul enfrenta sua terceira guerra civil em 50 anos 
1287,Os seguidores de Morsi incendeiam as universidades no Egito 
1288,Maduro amplia o domínio do setor militar sobre o Governo da Venezuela 
1289,Um ‘Wikileaks’ peruano revela segredos do Governo Humala 
1290,A China afrouxa a política do filho único e fecha os campos de reeducação 
1291,Rússia busca petróleo e gás da Síria 
1292,Governo argentino aumenta em 66% a passagem de ônibus 
1293,Um juiz dos EUA decide que coleta de dados pela NSA é legal 
1294,A onda de calor mais longa em cem anos deixa três mortos na Argentina 
1295,Confrontos no Egito deixam 3 mortos e quase 300 presos 
1296,A circuncisão das filhas do Nilo 
1297,A família Obama aproveita as festas de fim de ano em Honolulu 
1298,Um ex-ministro libanês da oposição a Al-Assad é assassinado 
1299,A crise dá asas à ‘iugonostalgia’ 
1300,Cristina Kirchner não será candidata nas eleições de 2015 
1301,Especialistas russos asseguram que Arafat morreu por causas naturais 
1302,A visita de Abe ao santuário de Yasukuni irrita Pequim e Seul 
1303,Como se ensina história contemporânea na Venezuela? 
1304,Três ministros turcos se demitem após grande ação contra a corrupção 
1305,O Papa pede que se permita a ajuda humanitária na Síria 
1306,Irmandade Muçulmana é declarada “organização terrorista” pelo Egito 
1307,Um grupo de crianças bloqueia a lei que veta trabalho infantil na Bolívia 
1308,Venezuela recebe o Natal sem conhecer a cifra oficial da inflação 
1309,As empresas dos EUA dão as costas às vítimas de Bangladesh 
1310,Cada vez mais latino-americanas chegam grávidas aos quinze anos 
1311,“Sigo trabalhando para a NSA. Eles são os únicos que não se dão conta” 
1312,Um atentado no Egito deixa 14 mortos e 100 feridos 
1313,Israel bombardeia Gaza depois da morte de um civil na fronteira 
1314,Kim Jong-un executou o tio para ter o controle dos negócios do país 
1315,"Turing, condenado por ser gay, recebe o perdão real 60 anos depois "
1316,A próxima execução de um mexicano nos Estados Unidos atravessa a fronteira 
1317,A década das mulheres no poder 
1318,O primeiro gol contra o belicismo 
1319,"Após o golpe, o Egito chega ao auge do retrocesso "
1320,A Justiça absolve o ex-presidente De la Rúa num escândalo de suborno 
1321,O triste Natal de Silvio Berlusconi 
1322,Os ‘barris da morte’ causam centenas de mortes na Síria 
1323,"Morre Mikhail Kalashnikov, inventor da arma mais usada no mundo "
1324,As cicatrizes da guerra nas crianças colombianas 
1325,“Estávamos dispostos a tudo pela reforma energética” 
1326,As Pussy Riot são libertadas 
1327,A hora das vítimas na Colômbia 
1328,"Suárez, o homem conciliador "
1329,O ano que botou em xeque a segurança na Cidade do México 
1330,A revolução estéril 
1331,A quebra da linha aérea uruguaia arrasta o ministro de Economia 
1332,Três conhecidos ativistas egípcios são condenados a três anos de prisão 
1333,“Montevidéu não será como Amsterdã” 
1334,Israel: “A espionagem por parte de países amigos é inaceitável” 
1335,"A quinoa chega à NASA, mas se afasta dos consumidores andinos "
1336,A onda expansiva desatada por Snowden 
1337,Putin ganha o jogo 
1338,A CIA ajudou a Colômbia a matar dirigentes das FARC 
1339,O martelo do ajuste português 
1340,Conduzindo ‘Mrs Thatcher’ 
1341,O Mossad treinou Mandela antes da prisão 
1342,Uma bomba-relógio nas águas territoriais alemãs 
1343,"“Se eu fosse presidente da Colômbia, haveria um golpe de Estado” "
1344,Bolívia lança na China seu primeiro satélite de telecomunicações 
1345,O Governo da Venezuela aumentará a gasolina de forma progressiva 
1346,Decifrando o intérprete 
1347,Panamá lembra o aniversário da “vergonhosa” invasão dos EUA 
1348,O misterioso destino do avião de Chávez 
1349,Obama promete uma reforma da espionagem para torná-la mais confiável 
1350,"Mijáil Jodorkovski, o homem que desafiou Putin "
1351,O oligarca Mijáil Jodorkovski sai da prisão depois de Putin assinar o indulto 
1352,Uruguai faz seguro contra falta de chuva 
1353,"Morre Hugo Chávez, nasce o chavismo "
1354,Putin anuncia que indultará ao oligarca Jodorkovski “em breve” 
1355,Parte de um teatro de Londres cai em plena apresentação 
1356,Washington acredita que é cedo para que Rousseff visite a Casa Branca 
1357,Cuba libera a compra e venda de veículos 
1358,Maduro abre um espaço de diálogo com a oposição venezuelana 
1359,Merkel pressiona para refundar a Europa 
1360,A ONU vota por unanimidade limitar a espionagem internacional 
1361,Obama decidirá sobre a reforma da espionagem dos EUA em janeiro 
1362,Paraguai volta atrás e aprova a entrada da Venezuela no Mercosul 
1363,O Senado dos EUA aprova um orçamento fruto de acordo bipartidário 
1364,O papa Francisco anuncia que irá à Argentina em 2016 
1365,"“A gente, por fim, sente que tem direitos e que pode os exercer” "
1366,A Venezuela tenta limitar as notícias sobre insegurança na mídia 
1367,Incidente naval entre China e EUA 
1368,Rússia anistia Pussy Riot e Greenpeace 
1369,O ‘ladrão do século’ Ronald Biggs morre aos 84 anos 
1370,Ministros de Finanças da UE decidem o mecanismo de fechamento de bancos 
1371,Diretores de Internet expressam a Obama suas queixas sobre a espionagem 
1372,O auge econômico da América Latina não reduz a informalidade 
1373,O novo símbolo do poder na Nicarágua 
1374,O papa Francisco comemora seu aniversário com quatro mendigos 
1375,Moscou empresta 15 bilhões de dólares a Kiev e vai baratear gás 
1376,"Imigrantes são fumegados contra a sarna
em Lampedusa "
1377,"Na América Latina, não aproveitar o lixo é um desperdício "
1378,As elites norte-coreanas prometem lealdade a Kim Jong-un 
1379,O Japão reforça política de defesa diante da crescente ameaça militar chinesa 
1380,Uma jovem mexicana que denunciou estupro acaba acusada de homicídio 
1381,Rússia implanta mísseis perto das fronteiras com a Polônia e Lituânia 
1382,A ONU faz o maior pedido de doações da história para ajudar a Síria 
1383,Um juiz acredita que é “muito provável” que os programas da NSA sejam inconstitucionais 
1384,Vitória de Bachelet é um marco no amadurecimento democrático do Chile 
1385,O falso intérprete do funeral de Mandela participou em dois assassinatos 
1386,Os cabelos brancos podem custar caro aos latinos-americanos 
1387,A universidade de Harvard evacua vários edifícios por um aviso de bomba 
1388,O ano em que mais gritamos 
1389,O Rio de Sangue e a Lança da Nação 
1390,"Vidas, tudo menos paralelas "
1391,A abstenção no Chile atinge níveis históricos de 59% 
1392,Bachelet voltará a presidir o Chile após conseguir uma ampla vitória 
1393,Escolas manchadas de sangue 
1394,2013 na América em dez imagens 
1395,Dez corpos carbonizados em uma caminhonete no sul do México 
1396,Os perigos de uma aliança heterogênea demais 
1397,O primeiro trem-bala direto faz o trecho Paris-Barcelona em seis horas e meia 
1398,"A Avenida Paulista, fronteira da velha São Paulo "
1399,O adeus a Mandela mostra uma sociedade que superou a questão racial 
1400,"A abstenção, principal rival das candidatas a presidir o Chile "
1401,O Governo da Venezuela defende a necessidade de aumentar a gasolina 
1402,Milhares vão às ruas na Colômbia contra destituição do prefeito da capital 
1403,Nelson Mandela volta para casa 
1404,600 mortos em sete dias na República Centro-Africana 
1405,China teme o colapso do ‘reino ermitão’ 
1406,"Na América Latina, a Justiça também viaja de ônibus "
1407,O norte-americano desaparecido no Irã desde 2007 trabalhava para a CIA 
1408,O comitê de revisão da NSA recomenda limitar sua espionagem 
1409,O falso intérprete do funeral de Mandela foi acusado por assassinato 
1410,Kim Jong-un reforça seu reino com terror 
1411,“O narcotraficante Chapo é um gênio dos negócios” 
1412,Câmara dos Deputados dos EUA aprova um orçamento bipartidário 
1413,Putin celebra o retorno do poder russo 
1414,Suárez: seus momentos chaves 
1415,A Coreia do Norte executa um tio do ditador Kim Jong-un 
1416,Um mentor muito influente 
1417,A declaração solene de Rajoy 
1418,O Governo espanhol recusa o referendo de independência da Catalunha 
1419,A seca: inimiga silenciosa da América Latina 
1420,Os chineses exploram a Nicarágua 
1421,"África do Sul, à caça do falso intérprete da língua de sinais "
1422,EUA e Reino Unido suspendem a ajuda militar aos rebeldes sírios 
1423,A solidão da viúva de Pinochet 
1424,Funes: “A oligarquia ordenhou El Salvador e enriqueceu” 
1425,O México abre o petróleo ao investimento privado e estrangeiro 
1426,O aperto de mãos de Obama e Raúl Castro divide os cubanos de Miami 
1427,Maduro nomeia “prefeitos paralelos” em municípios onde a oposição ganhou 
1428,Onda de saques com mortes ganha força com greve policial na Argentina 
1429,Uma corrida permanente entre preços e salários 
1430,Os líderes do Congresso chegam a um acordo orçamentário para evitar outra paralisação do governo 
1431,Aprovada na Nicarágua a reforma que assegura a reeleição a Ortega 
1432,A África do Sul se despede de Mandela 
1433,Dilma: “Mandela inspirou a luta no Brasil e na América do Sul” 
1434,O Governo controla 70% das prefeituras e ganha o plebiscito 
1435,O verdadeiro lar de Mandela 
1436,Faltam turistas no Brasil 
1437,O ministério público colombiano destitui e inabilita o prefeito de Bogotá 
1438,Uma pobreza radioativa 
1439,Dilma e quatro ex-presidentes viajam para funeral de Mandela 
1440,Gigantes da tecnologia pedem a regulação da espionagem digital 
1441,"Na festa em honra a Mandela, os políticos não contam "
1442,"O chavismo amplia sua vantagem
sobre a oposição na Venezuela "
1443,Argentina padece outra noite de saques 
1444,As FARC decretam 30 dias de cessar-fogo 
1445,“O Estado de bem-estar é um sucesso irrenunciável na Espanha e na UE” 
1446,Os pró-europeus endurecem nas ruas contra o presidente da Ucrânia 
1447,O México discutirá uma reforma energética mais liberalizante 
1448,"Ciudad Juárez, paz entre cadáveres "
1449,As últimas 48 horas de Mandela 
1450,O ‘anjo da guarda’ de Snowden 
1451,O cortejo de Mandela passará por ruas de Pretória durante três dias 
1452,As FARC indignam a Colômbia com ataque enquanto negocia a paz 
1453,O único símbolo de união para todos 
1454,Os protestos salariais dos policiais argentinos se estendem pelo país 
1455,O adeus a Nelson Mandela 
1456,O significado de Mandela para o futuro da humanidade 
1457,A morte de um libertador 
1458,A força da reconciliação 
1459,Os EUA perdem seu herói nacional 
1460,"""Seu tempo na prisão foi crucial"" "
1461,Seis internados depois de roubar cobalto no México 
1462,Biden tenta dissipar temores e reafirma em Seul a virada dos EUA para a Ásia 
1463,Soweto chora por Madiba 
1464,"Mandela, de símbolo contra o apartheid a presidente "
1465,"Um país melhor, mas não tanto "
1466,Morre Nelson Mandela 
1467,O grande amigo de Mandela nas Américas foi Fidel Castro 
1468,Um motor da luta contra a discriminação nos EUA 
1469,Um líder além da lenda 
1470,“Os ladrões do caminhão radioativo podem morrer” 
1471,A metade do Brasil é irmã de Mandela 
1472,"""A luta é minha vida"" "
1473,Obama: “Mandela agora pertence à eternidade” 
1474,"Madiba, o pai da África do Sul democrática "
1475,O Brasil sufocou Nelson Mandela de “tanto amor” 
1476,Um temporal mata quatro pessoas e mantém em alerta o norte da Europa 
1477,"Morre Nelson Mandela, o homem que libertou a África do Sul negra "
1478,Seguindo os passos de Nelson Mandela 
1479,"América Latina, onde há muitos empresários e faltam inovadores "
1480,Biden pede que China tome medidas para diminuir a tensão na Ásia-Pacífico 
1481,Uma solução ruim 
1482,Capriles encara as municipais como um plebiscito contra Maduro 
1483,O papa Francisco foi porteiro de boate na sua juventude na Argentina 
1484,Obama cita a desigualdade como “o maior desafio de nosso tempo” 
1485,A ONU emite um alerta após roubo de carga radioativa no México 
1486,Biden tenta reduzir em Pequim a tensão pela nova zona de defesa aérea chinesa 
1487,AMLO: o líder sem um número dois 
1488,O Senado mexicano quebra um tabu e aprova a reeleição 
1489,Os saques a lojas provocam duas mortes na Argentina 
1490,Um infarto afasta por cinco dias o líder da esquerda mexicana 
1491,Obama diz que que não revogará a reforma da saúde 
1492,Mãe e filha perdidas na Guerra Civil de El Salvador se encontram 
1493,EUA investem economicamente para acelerar o processo de paz 
1494,Os peritos franceses descartam que Arafat morreu por envenenamento 
1495,Governo argentino aposta na desvalorização do peso 
1496,Uma caravana de mães busca seus filhos desaparecidos no México 
1497,América Latina ocupa as últimas posições de relatório PISA 
1498,O Governo da Venezuela intervém na produção e venda de veículos 
1499,"Entre os negócios e a paz, Santos visita os Estados Unidos "
1500,Seul assegura que Coreia do Norte eliminou um tio do líder Kim Jong-un 
1501,Maduro reúne os militares pelo apagão que escureceu a Venezuela 
1502,A ONU vincula altos oficiais sírios a crimes de guerra 
1503,Os EUA não reconhecem o novo espaço aéreo da China 
1504,Cristina Kirchner troca ministro que estava há seis meses no cargo 
1505,O desencanto fortalece os radicais 
1506,O acidente na linha de trem em Nova York pode ser sido provocado pela alta velocidade 
1507,A introdução do salário mínimo divide os alemães 
1508,López Obrador faz outro alarde e protesta contra a reforma de Pemex 
1509,A cidade mexicana onde foram achados 67 corpos tenta mostrar calma 
1510,Dispara a violência nos protestos da oposição na Ucrânia 
1511,Ao menos quatro mortos e mais de 60 feridos em um descarrilamento de trem em Nova York 
1512,O retorno após o horror da guerrilha na Colômbia 
1513,Shimon Peres: “A vitória será a paz” 
1514,"Peña Nieto muda as leis, mas não o México em seu primeiro ano de mandato "
1515,A Bélgica esconde o homem leopardo 
1516,O capitão da política argentina 
1517,A história de nove cadáveres que ainda não estão mortos 
1518,EUA pedem as suas companhias aéreas que notifiquem seus voos à China 
1519,Pastrana abre feridas de ligações do narcotráfico com políticos colombianos 
1520,Oito pessoas morreram na queda de um helicóptero sobre um pub em Glasgow 
1521,Maduro prossegue a viagem rumo ao socialismo real 
1522,Multas de até 95.000 reais para as “ofensas” contra a Espanha 
1523,"A ‘marca Espanha’, apesar da Espanha "
1524,"Matteo Renzi, um heterodoxo vislumbra o poder na Itália "
1525,Peña Nieto diz que fará a reforma política mesmo sem a esquerda 
1526,O Pacto pelo México cambaleia após a esquerda sair do acordo 
1527,O Congresso mexicano quer permitir a reeleição de políticos 
1528,Peru multa a Pluspetrol pelo desaparecimento de uma lagoa 
1529,Matança na Amazônia do Equador será julgada como genocídio 
1530,Egito condena menores de idade a 11 anos de prisão por protestarem 
1531,Lula elogia Camila Vallejo em sua visita ao Chile 
1532,Nova tensão entre Colômbia e Nicarágua pela disputa de limites marítimos 
1533,A Igreja enfrenta a reforma de Ortega 
1534,Human Rights Watch diz que Peña Nieto não tem um plano contra o narcotráfico 
1535,O Senado italiano aprova a cassação de Silvio Berlusconi 
1536,O FMI aprova o primeiro ano do presidente mexicano 
1537,Procuradoria do México encontra 48 corpos em 25 fossas em uma mesma cidade 
1538,EUA ameaçam retirar as tropas do Afeganistão se não houver acordo 
1539,Merkel e bloco social-democrata fecham acordo para governo de coalizão 
1540,Maduro ocupa outra empresa para evitar o desabastecimento 
1541,Dois B-52 dos EUA sobrevoam o espaço aéreo reivindicado pela China 
1542,A CIA usa infiltrados em Guantánamo 
1543,Portugal aprova um orçamento restritivo em meio a protestos 
1544,EUA e México compartilharão aeroporto no próximo ano 
1545,Promotoria não encontra um motivo para o massacre de Newtown 
1546,A Casa Branca aumenta a pressão para aprovar a reforma migratória 
1547,As ‘escravas’ de Londres estavam em poder de uma seita maoista 
1548,Obama fica sozinho na defesa do acordo nuclear com o Irã 
1549,Os iranianos recebem negociadores de acordo nuclear como heróis 
1550,A ONU anuncia a primeira conferência de paz sobre a Síria em janeiro 
1551,"Matteo Renzi, um heterodoxo vislumbra o poder na Itália "
1552,Peña Nieto diz que fará a reforma política mesmo sem a esquerda 
1553,O Pacto pelo México cambaleia após a esquerda sair do acordo 
1554,O Congresso mexicano quer permitir a reeleição de políticos 
1555,Peru multa a Pluspetrol pelo desaparecimento de uma lagoa 
1556,Matança na Amazônia do Equador será julgada como genocídio 
1557,Egito condena menores de idade a 11 anos de prisão por protestarem 
1558,Lula elogia Camila Vallejo em sua visita ao Chile 
1559,Nova tensão entre Colômbia e Nicarágua pela disputa de limites marítimos 
1560,A Igreja enfrenta a reforma de Ortega 
1561,Human Rights Watch diz que Peña Nieto não tem um plano contra o narcotráfico 
1562,O Senado italiano aprova a cassação de Silvio Berlusconi 
1563,O FMI aprova o primeiro ano do presidente mexicano 
1564,Procuradoria do México encontra 48 corpos em 25 fossas em uma mesma cidade 
1565,EUA ameaçam retirar as tropas do Afeganistão se não houver acordo 
1566,Merkel e bloco social-democrata fecham acordo para governo de coalizão 
1567,Maduro ocupa outra empresa para evitar o desabastecimento 
1568,Dois B-52 dos EUA sobrevoam o espaço aéreo reivindicado pela China 
1569,A CIA usa infiltrados em Guantánamo 
1570,Portugal aprova um orçamento restritivo em meio a protestos 
1571,EUA e México compartilharão aeroporto no próximo ano 
1572,Promotoria não encontra um motivo para o massacre de Newtown 
1573,A Casa Branca aumenta a pressão para aprovar a reforma migratória 
1574,As ‘escravas’ de Londres estavam em poder de uma seita maoista 
1575,Obama fica sozinho na defesa do acordo nuclear com o Irã 
1576,Os iranianos recebem negociadores de acordo nuclear como heróis 
1577,A ONU anuncia a primeira conferência de paz sobre a Síria em janeiro 
1578,O ex-presidente Zelaya impugna a vitória do seu rival em Honduras 
1579,Árabes desconfiam do diálogo com Irã 
1580,A jogada de mestre de Cristina Kirchner 
1581,A luxuosa vida dos traficantes de droga mexicanos 
1582,Os filhos dos chefes do narcotráfico em tempo real 
1583,O Rei da Espanha recebe alta hospitalar 
1584,“Vou construir e liderar uma alternativa política na Argentina” 
1585,A direita volta a ganhar as eleições em Honduras 
1586,O príncipe Felipe suspende viagem ao Brasil por avaria no avião 
1587,Elementos estratégicos do ponto dois de Havana 
1588,"EUA, ante seu maior desafio desde o fim da União Soviética "
1589,Felizes pactos 
1590,Obama enaltece a via diplomática que levou ao pacto com Irã 
1591,Israel critica o acordo com Irã por considerá-lo um erro histórico 
1592,Os pontos-chave do pacto nuclear 
1593,A China defende as fronteiras do seu império 
1594,Não a qualquer preço 
1595,Irã e as potências chegam a um acordo sobre o programa nuclear iraniano 
1596,O grande dia de Manuel Zelaya 
1597,A oposição marcha contra a deriva autoritária de Maduro 
1598,Coordenador de campanha de Capriles deixa a prisão 
1599,A xeique da arte 
1600,“Alemanha será menos dura se o Sul da Europa fizer seus deveres” 
1601,As potências avisam sobre as dificuldades na negociação nuclear com Irã 
1602,A figura do deposto José Manuel Zelaya agita Honduras 
1603,A oposição venezuelana volta à rua após sete meses sem protestos 
1604,Sem eletrodomésticos nas lojas 
1605,A odisseia de um colombiano sequestrado no México 
1606,“Correntes invisíveis” impediram a fuga das três mulheres de Londres 
1607,Polônia anuncia acordos na Conferência do Clima 
1608,"Fidel Castro, o suspeito habitual "
1609,EUA homenageiam Kennedy como inspiração contra seu declínio 
1610,Dallas lava suas feridas e relembra Kennedy 50 anos após o crime 
1611,O crime marca a eleição em Honduras 
1612,O primeiro presidente que reconheceu o poder dos hispânicos 
1613,Santos terá que enfrentar o voto em branco e o uribismo 
1614,As duas leis decretadas por Maduro aumentam o controle sobre a economia 
1615,A sentença do “bunga bunga” 
1616,"O PIB mexicano sobe 0,84% no terceiro trimestre do ano "
1617,Yellen conquista primeiro voto para presidir Banco Central dos EUA 
1618,Um murro na mesa 
1619,O Senado elimina o veto minoritário a nomeações do presidente 
1620,Grupos civis armados avançam na tomada de municípios no México 
1621,"De Kennedy a Obama, dois símbolos de suas gerações "
1622,Quem matou Kennedy? 
1623,Rei é operado do quadril pela quinta vez e só voltará a caminhar em 10 semanas 
1624,Colômbia espera que as FARC renunciem ao uso da violência 
1625,Uruguai: as vacas que transformaram a economia do país com sua ‘personalidade’ 
1626,O soviético toma o leme argentino 
1627,Polícia confirma que detido é autor dos disparos contra o jornal ‘Libération’ 
1628,Espanha prepara uma lei de segurança para punir manifestantes 
1629,Maduro: “O que vocês viram é pouco diante do que vou fazer” 
1630,A oposição convoca uma marcha contra a Lei Habilitante de Maduro 
1631,Kerry diz que os EUA têm acordo de segurança com o Afeganistão 
1632,EUA tiveram permissão do Reino Unido para espionar cidadãos 
1633,Assembleia afegã avalia o acordo de segurança feito com os EUA 
1634,Resgatadas em Londres três mulheres sequestradas há 30 anos 
1635,Biden diz que América Latina não é mais o quintal dos Estados Unidos 
1636,Santos confirma que vai concorrer a um segundo mandato na Colômbia 
1637,Cristina Fernández retoma a presidência com mão de ferro 
1638,Temor com cartéis de droga provoca alerta de governo dos EUA 
1639,Peru segue sendo rota para entrada de imigrantes haitianos no Brasil 
1640,"A economia chilena: forte, mas desigual "
1641,Uma líder discreta 
1642,China lança as maiores reformas econômicas e sociais em décadas 
