823,“A Europa deve fazer o possível para evitar a guerra civil na Ucrânia” 
824,Domingo na dacha de Yanukóvich 
825,"A mão direita de Timoshenko, o novo presidente "
826,Os EUA vão pedir a extradição 
827,A UE e o FMI oferecem ajuda financeira à Ucrânia 
828,A justiça decide contra o aborto na Bolívia 
829,O ETA levou as armas “inutilizadas” depois de gravar o vídeo 
830,Uma onda de crimes mafiosos sacode Israel 
831,O primero-ministro italiano Renzi vai à guerra 
832,A prisão de 'El Chapo' fragmentará o tráfico no México 
833,Dez dias de cerco para prender o traficante mais procurado do mundo 
834,O que está em jogo na Venezuela? 
835,"A violência política na Venezuela
tem duas novas vítimas "
836,Capriles perde protagonismo como líder da oposição da Venezuela 
837,O calvário do Santo Sepulcro 
838,As ruas derrubam o regime ucraniano 
839,A captura de El Chapo: oxigênio para Peña Nieto 
840,A oposição venezuelana exibe força e unidade contra a repressão 
841,O capo que atuava como um grande empresário 
842,Preso no México ‘El Chapo’ Guzmán 
843,Brasil e México competem para ver quem é o melhor amigo de Cuba 
844,O planeta dos macacos 
845,A Itália estreia seu primeiro Governo paritário 
846,Maduro redobra a perseguição aos meios de comunicação 
847,O risco das altas expectativas 
848,Yanukóvich oferece eleições antecipadas e um corte nos poderes 
849,Os seis verificadores 
850,O ETA encena diante dos verificadores a entrega de parte do arsenal 
851,“O dano na Coreia do Norte é quase como o Holocausto” 
852,Aumenta a perseguição política na Venezuela depois dos protestos 
853,A UE aprova as primeiras multas enquanto trata de frear a violência 
854,O regime ucraniano intensifica a repressão no dia mais sangrento 
855,Os EUA pedem ao presidente da Ucrânia a retirada da polícia 
856,Presos três guardas de Auschwitz em operação contra nazistas 
857,As fronteiras de um país bipolar 
858,Maduro começa a perder o controle dos grupos armados na Venezuela 
859,O Governo de Maduro militariza um Estado da Venezuela 
860,Os líderes da América do Norte impulsionam o Acordo Transpacífico 
861,O primeiro abraço de irmãos coreanos depois de 60 anos 
862,Obama se interessa por reformas de economia e de segurança do México 
863,O presidente da Ucrânia aceita trégua após convocar o Exército 
864,"Uma miss, a quinta vítima fatal dos protestos "
865,O opositor López alerta seguidores na Venezuela para uma longa luta 
866,“A Colômbia é o país mais promissor da América Latina” 
867,Peña e Obama buscam melhorar a competitividade da região 
868,A vida escura dos homens que iluminam o México 
869,O náufrago tem medo do mar 
870,O Papa viajará com passaporte argentino 
871,O protesto diante do Parlamento da Ucrânia é dissolvido com violência 
872,A Casa Branca pede que se investigue a violência na Venezuela 
873,Rebeca Grynspan será a nova secretária geral ibero-americana 
874,Venezuela se parte nas ruas 
875,O opositor Leopoldo López se entrega à polícia venezuelana 
876,A polícia política põe Maduro em apuros 
877,Ao menos cinco mortos nos protestos em frente ao Parlamento de Kiev 
878,"“No México, os direitos humanos vão pelo caminho errado” "
879,Um desertor norte-coreano: “Delatei minha mãe por arroz” 
880,"""O apoio da América Latina a Maduro é inaceitável"" "
881,Os protestos não dão trégua a Maduro 
882,Argentina aprova a proposta do grupo Clarín de dividir-se em seis 
883,Napolitano pede a Renzi que forme um governo na Itália 
884,ONU: “Coreia do Norte usa a fome para controlar a população” 
885,"Brasil, Argentina, Uruguai e Paraguai respaldam Maduro "
886,O bom momento da economia peruana está sob suspeita 
887,Opositor convoca marcha para se entregar à Justiça na Venezuela 
888,Um escândalo por corrupção sacode o Exército colombiano 
889,Merkel propõe criar uma rede de dados para evitar a ciberespionagem 
890,A oposição venezuelana convoca uma grande marcha contra a violência 
891,Mais de 200 trabalhadores presos em uma mina ilegal na África do Sul 
892,Experimento na América Latina 
893,Maduro corta o transporte nos redutos da oposição em Caracas 
894,Suíça reaviva velhos temores na UE 
895,Berlusconi aproveita a queda de Letta para voltar ao cenário político 
896,A descoberta de outros dois corpos eleva para 15 os mortos de Ceuta 
897,A revista ‘Time’ causa polêmica com uma capa de Peña Nieto 
898,O Exército colombiano nega ter realizado escuta ilegais 
899,A polícia reconstrói o acidente com trem em Santiago de Compostela 
900,A solidão da Venezuela 
901,Obama busca recuperar a confiança de seu próprio partido 
902,"Maduro, sobre o líder oposicionista: “O fascista deve ir preso” "
903,Kerry procura em Pequim o apoio chinês para reduzir as tensões na Ásia 
904,Um escândalo de pornografia infantil constrange governo de Merkel 
905,"Na América Latina, um da cada cinco jovens não estuda ou trabalha "
906,A oposição venezuelana se divide diante da violência nas ruas 
907,A Argentina admite sua inflação real 
908,Washington sofre a pior tormenta de neve em quatro anos 
909,Enrico Letta anuncia a sua renúncia como premiê italiano 
910,O Governo venezuelano ordena a captura do líder oposicionista Leopoldo López 
911,Cristina Kirchner analisa um corte dos subsídios 
912,Os organizadores do protesto se desvinculam da violência 
913,Protestos da oposição na Venezuela deixam três mortos 
914,A espionagem da inteligência colombiana afetou jornalistas 
915,Sem papel não há más notícias 
916,Os EUA criam rede para proteger empresas de ataques cibernéticos 
917,O náufrago salvadorenho volta a sua terra natal 
918,A Venezuela alcança a inflação mais alta do mundo 
919,A ONU alerta sobre a prisão dos retirados de Homs 
920,“América Latina sofre mais de 30% dos homicídios mundiais” 
921,Venezuela suspende remessas à Colômbia para proteger a moeda 
922,Reaviva no México a guerra das telecomunicações 
923,Uma pesquisa sobre a relação com Cuba leva o debate ao Congresso 
924,O jornalista mexicano sequestrado há uma semana é encontrado morto 
925,Dezenas de pessoas morrem em acidente de avião na Argélia 
926,As fotos manipuladas de Fidel Castro 
927,Termina na Venezuela o prazo para cumprir a lei de Preços Justos 
928,Hollande e Obama fazem aliança para agir na Síria e no Irã 
929,O Irã se reinventa no 35º aniversário da sua revolução 
930,A sombra da violência ameaça o turismo no México 
931,A maioria nos EUA apoia normalizar relações com Cuba 
932,El Salvador receberá como um herói o náufrago perdido no Pacífico 
933,O dilema do Brasil de adotar retaliações contra os EUA 
934,A Aliança do Pacífico elimina os impostos para a maioria dos produtos 
935,A situação pessoal de Hollande ofusca sua visita aos EUA 
936,Os países da UE aprovam o degelo nas relações com Cuba 
937,A oferta de nacionalidade a sefarditas satura os consulados espanhóis em Israel 
938,As manobras militares dos EUA e Seul aumentam a tensão na península coreana 
939,O desespero inflama a Bósnia 
940,Suíça terá cotas para europeus em seus postos de trabalho 
941,"O promotor pede 1,9 milhão de reais de multa para a filha do rei da Espanha "
942,Irã executa um poeta e outro ativista da minoria árabe 
943,O velhos fantasmas de Marianna 
944,O Papa desmente uma reunião com agentes sociais da Argentina 
945,O SPD impõe sua agenda na Alemanha 
946,América Latina desperdiça 15% dos alimentos que produz 
947,Maduro afirma que “chegará a hora” para a imprensa venezuelana 
948,Suíça decide se vai impor cotas à imigração de cidadãos europeus 
949,O feudo dos Kirchners prospera 
950,Protestos em Istambul contra a lei que censura a Internet 
951,Secretário de imigração britânico se demite por empregar uma imigrante ilegal 
952,Eu tenho um supermercado 
953,Em quem os jovens poderão confiar hoje? 
954,O Governo de Bachelet aprofunda sua crise a um mês de tomar posse 
955,O portfólio secreto da Stasi 
956,Entre o arquivamento e o banco dos réus 
957,A filha do Rei da Espanha: “Eu confiava no meu marido” 
958,Dois senadores dos EUA questionam a democracia argentina 
959,Por dentro da Stasi 
960,Mais de 130 feridos em protestos sociais na Bósnia 
961,A Casa Real tenta diminuir seu martírio após a filha do Rei depor 
962,"“Dane-se a União Europeia”, diz secretária dos EUA à diplomata "
963,O empresariado pede que os EUA e o Brasil relancem suas relações 
964,Uma ONG denuncia maus-tratos e tortura de mulheres presas no Iraque 
965,O passado como desculpa 
966,Texas executa a décima quarta mulher nos EUA desde 1976 
967,A tragédia de Ceuta passo a passo 
968,Sochi se blinda contra a ameaça do terrorismo islâmico nos Jogos 
969,Mil imigrantes subsaarianos são resgatados perto de Lampedusa 
970,Uma dezena de imigrantes morre enquanto tentavam nadar até Ceuta 
971,Jornalista que denunciou sequestros é raptado no México 
972,A Sacyr anuncia o fim da negociação com o Canal do Panamá 
973,As duas Coreias marcam reuniões de famílias separadas pela guerra 
974,Cristina Kirchner lança uma dura mensagem contra os sindicatos 
975,"México anuncia um resgate de 8,2 bilhões de reais para Michoacán "
976,Bruxelas desbloqueia a eliminação de vistos para colombianos e peruanos 
977,O papa Francisco cogita a abertura dos arquivos secretos sobre o Holocausto 
978,A número dois da Educação no Chile se demite depois de denúncia estudantil 
979,Colômbia investiga se há espionagem nas negociações de paz com as FARC 
980,Hollande recua diante da pressão dos ultraconservadores 
981,Três em cada quatro europeus acreditam que a corrupção está generalizada 
982,O atual ritmo de pesca é uma ameaça para os oceanos 
983,O presidente Mujica se reuniu com representantes das FARC em Havana 
984,O portfólio secreto da Stasi 
985,Entre o arquivamento e o banco dos réus 
986,A filha do Rei da Espanha: “Eu confiava no meu marido” 
987,Dois senadores dos EUA questionam a democracia argentina 
988,Por dentro da Stasi 
989,Mais de 130 feridos em protestos sociais na Bósnia 
990,A Casa Real tenta diminuir seu martírio após a filha do Rei depor 
991,"“Dane-se a União Europeia”, diz secretária dos EUA à diplomata "
992,O empresariado pede que os EUA e o Brasil relancem suas relações 
993,Uma ONG denuncia maus-tratos e tortura de mulheres presas no Iraque 
994,O passado como desculpa 
995,Texas executa a décima quarta mulher nos EUA desde 1976 
996,A tragédia de Ceuta passo a passo 
997,Sochi se blinda contra a ameaça do terrorismo islâmico nos Jogos 
998,Mil imigrantes subsaarianos são resgatados perto de Lampedusa 
999,Uma dezena de imigrantes morre enquanto tentavam nadar até Ceuta 
1000,Jornalista que denunciou sequestros é raptado no México 
1001,A Sacyr anuncia o fim da negociação com o Canal do Panamá 
1002,As duas Coreias marcam reuniões de famílias separadas pela guerra 
1003,Cristina Kirchner lança uma dura mensagem contra os sindicatos 
1004,"México anuncia um resgate de 8,2 bilhões de reais para Michoacán "
1005,Bruxelas desbloqueia a eliminação de vistos para colombianos e peruanos 
1006,O papa Francisco cogita a abertura dos arquivos secretos sobre o Holocausto 
1007,A número dois da Educação no Chile se demite depois de denúncia estudantil 
1008,Colômbia investiga se há espionagem nas negociações de paz com as FARC 
1009,Hollande recua diante da pressão dos ultraconservadores 
1010,Três em cada quatro europeus acreditam que a corrupção está generalizada 
1011,O atual ritmo de pesca é uma ameaça para os oceanos 
1012,O presidente Mujica se reuniu com representantes das FARC em Havana 
1013,O grande túmulo dos meninos desobedientes 
1014,Mandela deixa uma herança calculada em 10 milhões de reais 
1015,"O Rei da Espanha fixa salários, pela primeira vez, à Rainha e à Princesa "
1016,Partido ex-guerrilheiro fica perto da vitória em El Salvador 
1017,A esquerda da Costa Rica fica fora do segundo turno eleitoral 
1018,Um bombardeio com barris explosivos deixa 85 mortos em Alepo 
1019,A ponte que unirá a fronteira mais movimentada do mundo 
1020,A crise da Ucrânia dispara a tensão entre a Rússia e o Ocidente 
1021,EUA reafirmam a sua supremacia com o auge energético e econômico 
1022,"Os acidentes de trânsito, a nova praga do mundo emergente "
1023,Seja europeu por um milhão de euros 
1024,Quando o medo se chama água 
1025,"Morales ataca o Brasil, o Chile e os EUA "
1026,"Manter ou mudar, o dilema nas eleições mais disputadas da Costa Rica "
1027,A emergência dos emergentes 
1028,A esquerda ex-guerrilheira busca manter o poder em El Salvador 
1029,Venezuela quer regular a circulação de motos para frear o crime 
1030,A guarda de fronteira dos EUA mostra a crianças como atirar 
1031,Cuba sai em busca de negócios na Flórida 
1032,O presidente de México promulga a reforma política 
1033,"Acaba a cúpula de paz da Síria, sem avanços nem concessões do regime "
1034,"Obama, aberto a debater a proposta republicana de reforma migratória "
1035,Um Airbus 330 será o terceiro avião do Príncipe da Espanha 
1036,Obama pode reduzir as penas de milhares de pequenos traficantes 
1037,O setor privado venezuelano exige em uníssono o pagamento da dívida 
1038,Polícia prende o ex-namorado de Knox na fronteira com Áustria 
1039,Exército exige que Yanukovych resolva crise na Ucrânia 
1040,Líder oposicionista ucraniano é encontrado com sinais de tortura 
1041,O novo diretor da NSA será o chefe de cibersegurança da Marinha 
1042,Um salvadorenho volta à civilização após um ano perdido no Pacífico 
1043,Funes: “A oligarquia tem que aprender a conviver com o FMLN” 
1044,EUA acreditam que a CELAC traiu os princípios democráticos da região 
1045,A Justiça italiana condena Amanda Knox a 28 anos de prisão 
1046,Por que Osama Bin Laden conseguiu escapar de Tora Bora? 
1047,O regime sírio destrói casas para castigar a oposição 
1048,A cúpula da CELAC acaba sem questionar os direitos humanos em Cuba 
1049,América Latina recorre à tecnologia para controlar desastres naturais 
1050,Berlim opta por uma quota feminina nas empresas 
1051,Obama em busca da credibilidade perdida 
1052,A UE confirma que abrirá uma negociação para uma parceria com Cuba 
1053,Brasil e México se lançam a ocupar posições em Cuba 
1054,"“A CELAC não pretende substituir a OEA, elas podem continuar coexistindo” "
1055,A América Latina reduziu em 5% o fosso salarial nas últimas duas décadas 
1056,“O Chile já está maduro para elaborar uma nova Constituição do zero” 
1057,Daniel Ortega consegue a reeleição por tempo indeterminado 
1058,"“Se ele não fosse presidente, talvez seguíssemos juntos” "
1059,Hollande vira à direita inspirado no pai das reformas alemãs 
1060,As cifras da desigualdade nos Estados Unidos 
1061,Obama faz uma apaixonada defesa da igualdade de oportunidades 
1062,O encontro de Havana começa sem menções à situação política de Cuba 
1063,A NSA usou aplicativos como Angry Birds para obter dados 
1064,Snowden acusa EUA de espionarem empresas europeias 
1065,Vitória diplomática de Cuba com a celebração da cúpula da Celac 
1066,EL PAÍS e o Banco Mundial firmam uma aliança pela informação 
1067,Chile respira aliviado 
1068,Peru celebra a obtenção de um território marítimo que não possuía 
1069,Haia toma decisão salomônica no caso entre Chile e Peru 
1070,“Viajo a Auschwitz. Beijos: teu Heini” 
1071,O Parlamento de Kiev abordará a “ameaça de divisão do país” 
1072,A disputa marítima entre Peru e Chile chega ao tribunal da ONU 
1073,O Peru e o Chile aguardam a sentença que definirá suas águas territoriais 
1074,O Governo egípcio muda sua direção e adianta as eleições presidenciais 
1075,Berlusconi se disfarça de velho 
1076,O milagre do ano 2000 
1077,Avião do Príncipe da Espanha faz pouso de emergência na República Dominicana 
1078,Hollande tira a máscara 
1079,O terceiro aniversário da revolução egípcia se tinge de sangue 
1080,Hollande anuncia sua ruptura com Trierweiler 
1081,Três mortos em um tiroteio em um shopping próximo a Washington 
1082,O colapso do peso vai parar a Argentina? 
1083,Seis pontos para entender a América Latina 
1084,O Peru arquiva o caso das esterilizações forçadas de Fujimori 
1085,O Banco Central da Argentina volta a vender dólares 
1086,As linhas aéreas estrangeiras se firmam contra Maduro 
1087,Os conflitos de vizinhos latino-americanos 
1088,Os latino-americanos perdem até quatro horas diárias em engarrafamentos 
1089,O regime sírio ameaça deixar as negociações de paz 
1090,“Amo a Bolívia e não gostaria que ela fosse submetida ao populismo” 
1091,As vítimas do tráfico mexicano relatam o horror em Michoacán 
1092,As esperanças de uma resolução política na Ucrânia se mantêm 
1093,O terrorismo golpeia o quartel general da segurança no Cairo 
1094,Hollande visita o Papa para se aproximar do eleitorado católico 
1095,Irã abre seu setor petrolífero ao investimento ocidental 
1096,Os opositores sírios aceitam seguir negociando com Bashar al-Assad 
1097,Uma comissão independente pede a eliminação da vigilância da NSA 
1098,O negócio sujo das prisões privadas nos EUA 
1099,Texas ignora as pressões internacionais e executa mexicano condenado a morte 
1100,Venezuela mascara uma nova desvalorização da moeda 
1101,Cristina Kirchner volta à cena após mais de um mês de silêncio 
1102,Os diretores de petroleiras criaram dúzias de empresas opacas 
1103,Os filhos diletos do poder 
1104,Cubanos poderão alugar imóveis 
1105,Maduro cria o vice-ministério para as redes sociais 
1106,As primeiras vítimas fatais agravam o conflito na Ucrânia 
1107,O Governo da Síria e a oposição iniciam o diálogo com duras acusações 
1108,A China recorre à censura após as revelações sobre paraísos fiscais 
1109,22.000 clientes da China ocultos em paraísos fiscais 
1110,Os paraísos fiscais escapam do cerco 
1111,Os escândalos de corrupção erodem o poder comunista 
1112,Chinaleaks: 37.000 nomes em sociedades fantasmas 
1113,A elite comunista da China oculta empresas em paraísos fiscais 
1114,A morte de um cantor evidencia a corrupção policial do México 
1115,"Uruguai, a boa notícia da região em direitos humanos "
1116,"Caos penitenciário, vítimas de policiais e agressões a gays. Assim foi o Brasil em 2013 "
1117,A HRW alerta sobre as democracias autoritárias na América Latina 
1118,Genebra II: Uma cúpula sem objetivos nem prazos 
1119,"Obama visitará o Papa em 27 de março, no Vaticano "
1120,A cidade onde a Europa morreu 
1121,Espanha supera a China como terceiro maior destino turístico do mundo 
1122,A batalha de Kiev 
1123,Holanda quer que os presidiários paguem 16 euros por dia de cárcere 
1124,A NSA possui a ‘impressão digital eletrônica’ da chanceler Merkel 
1125,Um relatório acusa o regime sírio de “torturas e assassinatos sistemáticos” 
1126,“O destino do Equador pode ser pior que o da Venezuela” 
1127,A ONU retira seu convite ao Irã para a cúpula de paz da Síria 
1128,O papa latino-americano: de Bergoglio a Francisco 
1129,A UE e os EUA suspendem parte das multas econômicas contra o Irã 
1130,A nave espacial que vai atrás do cometa desperta da hibernação 
1131,A imprensa nas Américas é livre? 
1132,Maduro é criticado pela esquerda por trair o legado de Chávez 
1133,“A reforma energética do México pode transformar o setor em cartel” 
1134,Chile e Peru se aproximam apesar de disputa fronteiriça a ser resolvida em Haia 
1135,Irã desliga centrífugas em cumprimento do pacto nuclear 
1136,ONU convida Irã a participar da cúpula de paz sobre a Síria 
1137,Milhares de ucranianos enfrentam as leis contra protestos nas ruas 
1138,A procuradoria alemã planeja abrir ação penal pelas escutas feitas ao telefone de Merkel 
1139,Marcha contra o aborto em Paris 
1140,Bolívia renova os presidentes da Câmara dos Deputados e do Senado 
1141,A Irmandade Muçulmana volta do poder à clandestinidade no Egito 
1142,"'Liberté, égalité, infidélité' "
1143,"“Me culpam por ser negra, mulher e estrangeira” "
1144,“Imagino representantes das FARC sentados no Congresso” 
1145,"Nadia muda de armas, mas continua na luta "
1146,A correspondência de um condenado à morte 
1147,"Alemanha celebra mudança, mas exige pacto antiespionagem "
1148,Os egípcios aprovam sua nova Constituição por ampla maioria 
1149,Pela primeira vez em mais de 50 anos um chefe da OEA visita Cuba 
1150,"Hiroo Onoda, o soldado japonês que não quis se render "
1151,A falta de papel-jornal na Venezuela 
1152,Julie Gayet no papelão da sua vida 
1153,A Anistia Internacional denuncia 40 execuções no Irã só em 2014 
1154,Obama elimina a coleta maciça de dados e a espionagem a líderes aliados 
1155,"Aos 50, Michelle Obama busca firmar seu legado como primeira-dama "
1156,"Pelos campos do México, o banco chega de moto "
1157,Obama anuncia mudanças nos programas de espionagem da NSA 
1158,Kerry afirma que um Governo sírio de transição sairá de Genebra 
1159,O Congresso dos EUA aprova um orçamento de 1 trilhão de dólares 
1160,Hollande visita pela primeira vez Trierweiler no hospital 
1161,Um novo projeto jornalístico no Equador enfrenta “linchamento midiático” 
1162,O Congresso impede que a CIA deixe de operar ‘drones’ 
1163,"Os latinos serão, em março deste ano, o grupo étnico majoritário na Califórnia "
1164,As rotas do tráfico de cocaína se multiplicam no Peru 
1165,Trierweiler continua sofrendo de “fadiga nervosa extrema” 
1166,Maduro aprofunda a aposta econômica de Chávez 
1167,A UE descongela a relação com Cuba 
1168,A Suprema Corte dos EUA arquiva um processo que associava a Daimler à ditadura argentina 
1169,A comunidade internacional arrecada fundos para a Síria no Kuwait 
1170,A ministra da Cultura anula uma nomeação da amante de Hollande 
1171,A fome mata na Síria 
1172,Chile convoca seu Conselho de Segurança pela sentença de Haia 
1173,Bolívia revisa o memorando que levará à Haia contra o Chile 
1174,Peru dá licença para matar a policiais e militares 
1175,"O debate sobre a imprensa no Peru
segue no Palácio do Governo "
1176,Egito vota a nova Constituição 
1177,A guerra de Michoacán 
1178,A procuradoria colombiana ratifica a destituição do prefeito de Bogotá 
1179,A infanta da Espanha vai depor na manhã de 8 de fevereiro 
1180,Vítimas mexicanas de abusos sexuais acusam o Vaticano de crimes de Estado 
1181,O escândalo sobre a suposta infidelidade de Hollande aumenta 
1182,O petróleo no México: a encruzilhada da democracia 
1183,Cinco coisas que podem definir o futuro do Haiti 
1184,Guatemala decreta segundo maior nível de alerta por uma erupção vulcânica 
1185,A violência mancha o feito de Peña Nieto de reduzir homicídios 
1186,“A retirada das tropas do Haiti deve ser feita de modo ordenado” 
1187,Putin joga duro 
1188,O general Al Sisi indica que será candidato à presidência no Egito 
1189,"Em condolências por Sharon, Obama pede o reconhecimento de dois estados "
1190,"Semana fatal para Joe Biden, Cristiano Ronaldo e Christie "
1191,Um negócio de 270 bilhões de dólares 
1192,A pressão acelera a resolução do assassinato da miss Venezuela 
1193,Galeria| Um especialista em destruir o que construiu 
1194,"Ariel Sharon, o general sem arrependimento "
1195,Morre Ariel Sharon 
1196,A fatídica viagem de Mónica Spear 
1197,O funeral da miss venezuelana se converte em um ato de massas 
1198,A notícia de uma amante secreta irrita Hollande 
1199,Peña Nieto aposta no crescimento econômico do México em 2014 
1200,"Los Angeles, uma cidade em declive "
1201,A proteção de Peña Nieto ao líder dos grupos de autodefesa causa polêmica no México 
1202,De um cárcere na Venezuela a uma mesa de negociações em Cuba 
1203,França proíbe os shows do comediante acusado de antissemitismo 
1204,Air Europa suspende a venda de bilhetes aéreos na Venezuela 
1205,O escândalo com Christie limita as opções republicanas à Casa Branca 
1206,México anuncia reunião com Raúl Castro para se aproximar de Cuba 
1207,“O aumento da força militar chinesa agrava a situação na Ásia” 
1208,Fidel Castro reaparece em público pela primeira em nove meses 
1209,O assassinato da miss acelera o plano de segurança de Maduro 
1210,Parlamento europeu quer ouvir Snowden 
1211,Egito adia o julgamento de Morsi 
1212,As críticas de Gates reforçam as dúvidas sobre a política externa de Obama 
1213,Quatro décadas no corredor da morte 
1214,O Governo mexicano estende a mão aos grupos de autodefesa 
1215,O assassinato de uma ex-miss altera a pauta política da Venezuela 
1216,A Justiça chilena ratifica que Salvador Allende se suicidou 
1217,EUA enviam ‘drones’ para ajudar o Iraque contra os jihadistas 
1218,Sai da Síria o primeiro carregamento de armas químicas que será eliminado 
1219,Panamá oferece um adiantamento a Sacyr para que esta retire a ameaça 
1220,De genro perfeito a homem tóxico 
1221,Uma mulher apaixonada 
1222,A diplomacia grotesca do basquete na Coreia do Norte 
1223,Uma filha do rei da Espanha acusada por crime fiscal 
1224,A polêmica marca de Pablo Escobar 
1225,O cansaço passa fatura ao rei da Espanha em sua reaparição mais esperada 
1226,A visita de Vargas Llosa a Bolívia desperta suspeita em Evo Morales 
1227,O Senado dos EUA vota em Yellen para presidenta da Reserva Federal 
1228,60% das armas de fogo rastreadas em El Salvador provêm dos EUA 
1229,Angela Merkel quebra a pélvis em acidente de esqui na Suíça 
